blocks,channel_id,client_msg_id,latest_reply,reply_count,reply_users,reply_users_count,subscribed,team,text,thread_ts,ts,type,user
"[{""type"": ""rich_text""}]",C0170U650CQ,a0b06d3e-51f2-4ff8-ab6f-48b568d3e146,,,null,,,T7GMC60JX,"Thank you for your suggestions. I have both use cases (`mysql`hosted in a docker container and locally), because I am testing both scenearions.  I tested Metabase before and it runs inside a Docker container as well and I was able to connect to both databases with those credentials.\n\nI already use the gateway IP as the host adress and set ``bind-address`` to ``0.0.0.0`` .\n\nFor the docker image, i do not want to add to docker-compose, since in the real-world szenario I am currently mocking, the database container is in a different network. So I need to find a way to make it work without adding the `mysql`image to `docker-compose`of `SuperSet`.\n\nFor the local installation, where should I add `host`? To which service in `docker-compose.yml`?",1600788172.025400,2020-09-22 15:22:52,message,U01BHSS072M
"[{""type"": ""rich_text""}]",C0170U650CQ,dd0628bc-43f0-4d92-a37e-d94f393c9a5f,,,null,,,T7GMC60JX,"For real world scenario it works fine without msql image as You expected just adding meta database credential on env . Because it hosted on Cloud server.\n\nIf you want to try-out,  checkout service named in `superset-tests-worker` docker-compose which does similar work.",1600791992.025600,2020-09-22 16:26:32,message,U0131V7SMEE
"[{""type"": ""rich_text""}]",C0170U650CQ,f0345929-59e2-42ca-9547-271dc13ea9ea,,,null,,,T7GMC60JX,"But how can I add the two local databases (one within a docker container, one as a local installation) I currently want to test Superset with? I am confused because it worked with Metabase which also runs inside a docker container",1600863491.005700,2020-09-23 12:18:11,message,U01BHSS072M
"[{""type"": ""rich_text""}]",C016B3LG5B4,e57af8ce-e2c3-4543-a457-b66d32099051,,,null,,,T7GMC60JX,"Thanks for your response Steve.\n\nI was trying to understand what are the treemap data assumptions.\n\nLooks like its assuming a table/resultset structure.\n\nMy resultset has really simple stuff going on.\nAll numeric columns:\nRecency, Count of people, no.of.rides\n\nI would've expected it to ask, what variable do you want to base colour on, what variable for size etc. In the absence of that, and no hint from the error, I'm still struggling to see what can be the ""incompatible"" value.",1603344538.030900,2020-10-22 05:28:58,message,U01D7A7PRNG
"[{""type"": ""rich_text""}]",C0195GT7S1Y,83cd9297-758e-4fad-8d16-98b0cec66174,,,null,,,T7GMC60JX,"<@UFP6V5W4E> <@U017A55PE9E> i posted your requests on github, and communicated internally. I will get back to you guys soon",1600878012.001200,2020-09-23 16:20:12,message,U017193F7JQ
"[{""type"": ""rich_text""}]",CH307T4JG,93f7233e-fc31-46f1-80d0-d48f477f038f,1601102335.005700,4,"[""UH0UPCJVD"", ""U017A55PE9E""]",2.0,,T7GMC60JX,"With 0.37.1\nThis log keeps repeating:\n```INFO:werkzeug:167.71.34.138 - - [25/Sep/2020 08:33:25] ""POST /ws/v1/cluster/apps/new-application HTTP/1.1"" 404 -```\nHave not looked into it yet, but just reporting for now. It seems to have no visible impact.",1601023420.003900,2020-09-25 08:43:40,message,U017A55PE9E
"[{""type"": ""rich_text""}]",C0170U650CQ,6df7418b-561d-49fd-918b-f8cc9389f9e6,,,null,,,T7GMC60JX,"Thanks for the response, that thread did not shed any light on my particular problem though. I can see the menu items fine and in the logs I can see the scheduler running but I get `connection refused` so that's why I think maybe it can't authenticate. I have also set the correct user to send the notifications as in the config as well.",1598830848.001800,2020-08-30 23:40:48,message,URQJZJKKK
"[{""type"": ""rich_text""}]",C015WAR4SDV,207c8371-61ee-40cf-b784-30a9f4d6823a,,,null,,,T7GMC60JX,"Hello Everyone, I am Chloe. A data PM from Dropbox. We are currently use superset internally as one of our primary analytical tooling",1599068253.001800,2020-09-02 17:37:33,message,U01A3JG6NE8
"[{""type"": ""rich_text""}]",C7G8CG0LR,be8e847d-a6f6-42af-bc93-8191005c3720,1603129595.248900,6,"[""U0144UAHXKJ"", ""U01A5H37BPY"", ""UFP6V5W4E"", ""U7HPM7JHL""]",4.0,,T7GMC60JX,"Hi does anyone have interesting *request* or *dashboard* for *superset usage, monitoring* and timings ?\nI'm willing to parse the log table and get some usefull insight (e.g. what dashboard is the slowest one...)\nI would be happy to share some requests/dash with other :superset: admins\nand post these into the superset doc afterward.",1601363491.061600,2020-09-29 07:11:31,message,U0144UAHXKJ
"[{""type"": ""rich_text""}]",C7G8CG0LR,67605def-6759-44af-84f4-028912d37fe1,,,null,,,T7GMC60JX,(Following this thread),1601402655.068200,2020-09-29 18:04:15,message,U01A5H37BPY
"[{""type"": ""rich_text""}]",CH307T4JG,2fc6d5a4-321e-45a3-9bcc-478fa88da87f,,,null,,,T7GMC60JX,"Its very odd. This is running on an standalone EC2 instance, with no yarn. I fired a curl to the URL\n`curl -v -X POST ""<http://localhost:8088/ws/v1/cluster/apps/new-application>""`\n\nAnd got the following:\n```curl -v -X POST ""<http://localhost:8088/ws/v1/cluster/apps/new-application>""\n*   Trying 127.0.0.1...\n* TCP_NODELAY set\n* Connected to localhost (127.0.0.1) port 8088 (#0)\n&gt; POST /ws/v1/cluster/apps/new-application HTTP/1.1\n&gt; Host: localhost:8088\n&gt; User-Agent: curl/7.58.0\n&gt; Accept: */*\n&gt; \n* HTTP 1.0, assume close after body\n&lt; HTTP/1.0 404 NOT FOUND\n&lt; Content-Type: text/html; charset=utf-8\n&lt; Content-Length: 232\n&lt; Server: Werkzeug/1.0.1 Python/3.6.9\n&lt; Date: Sat, 26 Sep 2020 06:30:25 GMT\n&lt; \n<!DOCTYPE HTML PUBLIC ""-//W3C//DTD HTML 3.2 Final//EN"">\n&lt;title&gt;404 Not Found&lt;/title&gt;\n&lt;h1&gt;Not Found&lt;/h1&gt;\n&lt;p&gt;The requested URL was not found on the server. If you entered the URL manually please check your spelling and try again.&lt;/p&gt;\n* Closing connection 0```\nWhat I don't understand is why is Superset trying to hit this URL. The 404 error is from the superset log.\n\n<http://pypi.org|pypi.org> says:\n<https://www.palletsprojects.com/p/flask/|Flask>\u00a0wraps Werkzeug, using it to handle the details of WSGI while providing more structure and patterns for defining powerful applications.",1601102335.005700,2020-09-26 06:38:55,message,U017A55PE9E
"[{""type"": ""rich_text""}]",C0170U650CQ,f0df236b-033d-4692-b12c-07b603c0a9fc,,,null,,,T7GMC60JX,"hey, nope - slack integration works exactly like email integration. Only difference that you need to specify slack token in the configuration",1598630110.028300,2020-08-28 15:55:10,message,UM4AW481K
"[{""type"": ""rich_text""}]",C0170U650CQ,a79a3f44-d16f-485a-b038-2c68079fa043,,,null,,,T7GMC60JX,"I plan to share more docs, but would happen probably some time in q4",1598630161.028800,2020-08-28 15:56:01,message,UM4AW481K
"[{""type"": ""rich_text""}]",C0170U650CQ,7edc5cbf-e6c1-439a-9972-71eb6029b7c7,,,null,,,T7GMC60JX,did you try with chrome browser?,1598859767.008200,2020-08-31 07:42:47,message,U0131V7SMEE
"[{""type"": ""rich_text""}]",C0170U650CQ,936226bf-cb59-4004-b6c9-9bee3c6df371,,,null,,,T7GMC60JX,"Yeah got a different error though\n```Task email_reports.send[a3e89f72-f70d-4842-9afa-a6c28b38c3fd] raised unexpected: WebDriverException(""unknown error: Chrome failed to start: crashed.\n  (unknown error: DevToolsActivePort file doesn't exist)\n  (The process started from chrome location /usr/bin/google-chrome is no longer running, so ChromeDriver is assuming that Chrome has crashed.)"", None, None)```",1598859869.008500,2020-08-31 07:44:29,message,URQJZJKKK
"[{""type"": ""rich_text""}]",C7G8CG0LR,9547cd72-42fc-4f4e-8576-42ad7f5845f4,,,null,,,T7GMC60JX,"Hmmm.... the fact that this is a server-side error makes me inclined to think that it's not your plugin causing the problem. At least, it's not one I've seen occur before! I would check the following if you're able:\n1. You browser's console logs for any interesting errors/warnings \n2. Your browser console's ""Network"" tab (assuming chrome) to see if you get any additional details in the error response from the server\n3. Your server logs (assuming you're running it locally) to see if the request throws any visible errors there.\n<@UMTM37Q64> <@UH0UPCJVD> have you encountered a 405 like this in the wild?",1598893510.008300,2020-08-31 17:05:10,message,UHK31ESN4
"[{""type"": ""rich_text""}]",C7G8CG0LR,67f3247a-4e69-4647-9f1e-37f58e18d5f3,,,null,,,T7GMC60JX,"ohoh, there is one there .. <https://github.com/apache/incubator-superset/issues/3317#issuecomment-323099626>\n&gt; Actually we log most page views in the ""logs"" table in the metadata database. We should ship a ""Superset usage"" dashboard along with the app. We have one internally that looks pretty neat. We also have one for Sql Lab usage as well.\n<@U7HPM7JHL> do you mind sharing your superset usage dashboard ?",1601363789.061700,2020-09-29 07:16:29,message,U0144UAHXKJ
